{
  "schemaVersion": "finance.runtime-build-result.v1",
  "buildId": "build-example",
  "requestId": "migration-example:revision-1",
  "requirementsDigest": "8444f6f7542124d7a0d8910fb8859e95b8830a582abc53faee161bbe362a7613",
  "status": "SUCCEEDED",
  "builder": {
    "name": "example-builder",
    "version": "1.0.0"
  },
  "artifact": {
    "mediaType": "application/vnd.finance.agent-runtime+zip",
    "uri": "artifact://runtime/build-example",
    "sha256": "02d997ab652649698f1cb863febc31bf23f6cb37ea56877ca8b9de1ad71a25ff"
  },
  "runtime": {
    "runtimeType": "openjiuwen",
    "version": "1.0.0",
    "protocols": {
      "registration": "finance.skill-eval.runtime-capabilities.v1",
      "instance": "finance.skill-eval.runtime-instance.v1",
      "execution": "finance.skill-eval.runtime-case.v1"
    },
    "requiredConfiguration": [
      {
        "name": "DOCUMENT_ROOT",
        "type": "string",
        "required": true,
        "sensitive": false
      }
    ]
  },
  "capabilityResults": [
    {
      "requirementId": "harness-1-read-document",
      "status": "IMPLEMENTED",
      "capabilityId": "workspace.read_document",
      "contractDigest": "338875fa3f9c45dd8cc346589ff42c8d21cad0ebd5c5de48a993d885c6543268",
      "verificationIds": [
        "contract-read-document"
      ]
    }
  ],
  "verifications": [
    {
      "id": "contract-read-document",
      "type": "CONTRACT_TEST",
      "status": "PASSED",
      "evidenceSha256": "bbbbbbbbbbbbbbbbbbbbbbbbbbbbbbbbbbbbbbbbbbbbbbbbbbbbbbbbbbbbbbbb"
    }
  ],
  "errors": [],
  "builtAt": "2026-09-29T12:00:00.000Z",
  "resultDigest": "524aa05a15d8f3eb91fd768870b5013c723ab84632dee5a26b524d9d8fa217a2"
}
